{
  "$schema": "https://json-schema.org/draft/2020-12/schema",
  "$id": "fleet-v4/fact",
  "title": "One entry of facts.jsonl — output of code-researcher / capability-analyst; every claim about existing behaviour needs evidence",
  "type": "object",
  "required": ["id", "claim", "evidence", "confidence", "by"],
  "properties": {
    "id": { "type": "string", "pattern": "^F-[0-9]+$" },
    "question": { "type": "string", "description": "the single question the researcher was asked" },
    "claim": { "type": "string" },
    "evidence": {
      "type": "array", "minItems": 1,
      "items": {
        "oneOf": [
          { "type": "object", "required": ["file", "line"], "properties": { "file": { "type": "string" }, "line": { "type": "integer", "minimum": 1 }, "excerpt": { "type": "string", "maxLength": 300 } } },
          { "type": "object", "required": ["captured_response"], "properties": { "captured_response": { "type": "string", "description": "verbatim HTTP response / swagger fragment" }, "source": { "type": "string" } } },
          { "type": "object", "required": ["generated"], "properties": { "generated": { "type": "string", "description": "path in generated/ (capability-map, swagger.base, core-surface)" } } }
        ]
      }
    },
    "confidence": { "type": "string", "enum": ["certain", "likely", "unknown"], "description": "unknown = 'I don't know' is a valid, expected answer" },
    "by": { "type": "string", "description": "agent_type + run_id" }
  }
}
