{"id":"F-4","question":"Migration and rename conventions in this repository (6 sub-points)","claim":"(1) Resources migrations live in backend/src/Modules/Resources/ThingsBooksy.Modules.Resources.Migrations/Migrations/ (InitResources, AddDescriptionToResourceInstance, AddResourceTypeUniqueAndCursorIndexes, SoftDeleteResourceTypeUniqueIndex + ResourcesDbContextModelSnapshot). No IDesignTimeDbContextFactory exists for Resources; the only DbContextFactory in backend is UsersDbContextFactory. Migrations assembly is wired via AddPostgres<ResourcesDbContext>(configuration, \"ThingsBooksy.Modules.Resources.Migrations\"); no MigrationsHistoryTable customisation found (default __EFMigrationsHistory; schema not set explicitly - not verified beyond grep absence). No RenameTable/RenameColumn/RenameIndex exists anywhere under backend (grep: no matches). The nearest precedent is an index 'rename-free' change: DropIndex + CreateIndex of IX_resource_types_GroupId_Name. (2) Test host (ThingsBooksyWebAppFactory) starts a postgres:16-alpine Testcontainer per factory, applies MigrateAsync() (not EnsureCreated) for every DbContext type, then uses Respawn (schemas users, management_groups, resources) to reset data between tests; the DB is therefore fresh per container, so a pre-existing dev DB is not involved in tests. The app itself runs MigrateAsync for all DbContexts at startup (DbContextAppInitializer), so a pre-existing dev DB would get pending migrations applied to it as written; what happens to data when a migration drops/recreates tables is not determined by any code here (no data-preservation logic found). (3) docker-compose / seed: unknown - no docker-compose*.yml found under backend/, and repo root is outside my read scope; no seed script for Resources found in backend (not exhaustively searched). (4) Naming: ResourcesDbContext uses HasDefaultSchema(\"resources\"); tables are explicit via ToTable (resource_types, resource_property_definitions, resource_property_values, resource_instances, group_read_models, group_member_read_models); no UseSnakeCaseNamingConvention, HasColumnName, HasConstraintName or HasDatabaseName found, so columns are PascalCase (e.g. \"GroupId\", \"DeletedAt\") and index/FK/PK names are EF defaults: IX_resource_types_GroupId_Name, IX_resource_instances_GroupId_Id, FK_resource_property_definitions_resource_types_ResourceTypeId, FK_resource_property_values_resource_instances_ResourceInstanc~ (truncated). (5) Outside Resources module, string references to resources.resource_types: ManagementGroups integration test client raw SQL (ManagementGroupsTestClient.cs:128). Within Resources: SoftDeleteResourceTypeTests.cs:64 (comment only). No other module's production code references them. (6) Migration naming: yyyyMMddHHmmss_PascalCaseName; last Resources migration is 20260928111659_SoftDeleteResourceTypeUniqueIndex.","evidence":[{"file":"backend/src/Modules/Resources/ThingsBooksy.Modules.Resources.Migrations/Migrations/20260928111659_SoftDeleteResourceTypeUniqueIndex.cs","line":13,"excerpt":"migrationBuilder.DropIndex(name: \"IX_resource_types_GroupId_Name\", schema: \"resources\", table: \"resource_types\");"},{"file":"backend/src/Modules/Resources/ThingsBooksy.Modules.Resources.Core/Extensions.cs","line":47,"excerpt":".AddPostgres<ResourcesDbContext>(configuration, \"ThingsBooksy.Modules.Resources.Migrations\")"},{"file":"backend/src/Modules/Users/ThingsBooksy.Modules.Users.Migrations/UsersDbContextFactory.cs","line":12,"excerpt":"internal sealed class UsersDbContextFactory : IDesignTimeDbContextFactory<UsersDbContext>"},{"file":"backend/src/Shared/ThingsBooksy.Shared.IntegrationTests/ThingsBooksyWebAppFactory.cs","line":108,"excerpt":"await context.Database.MigrateAsync();"},{"file":"backend/src/Shared/ThingsBooksy.Shared.IntegrationTests/ThingsBooksyWebAppFactory.cs","line":25,"excerpt":"new PostgreSqlBuilder().WithImage(\"postgres:16-alpine\")"},{"file":"backend/src/Shared/ThingsBooksy.Shared.IntegrationTests/ThingsBooksyWebAppFactory.cs","line":119,"excerpt":"SchemasToInclude = [\"users\", \"management_groups\", \"resources\"],"},{"file":"backend/src/Shared/ThingsBooksy.Shared.Infrastructure/Services/DbContextAppInitializer.cs","line":39,"excerpt":"await dbContext.Database.MigrateAsync(cancellationToken);"},{"file":"backend/src/Modules/Resources/ThingsBooksy.Modules.Resources.Core/DAL/ResourcesDbContext.cs","line":23,"excerpt":"modelBuilder.HasDefaultSchema(\"resources\");"},{"file":"backend/src/Modules/Resources/ThingsBooksy.Modules.Resources.Core/DAL/Configurations/ResourceTypeConfiguration.cs","line":11,"excerpt":"builder.ToTable(\"resource_types\");"},{"file":"backend/src/Modules/Resources/ThingsBooksy.Modules.Resources.Core/DAL/Configurations/ResourceTypeConfiguration.cs","line":17,"excerpt":"builder.HasIndex(t => new { t.GroupId, t.Name }).IsUnique().HasFilter(\"\\\"DeletedAt\\\" IS NULL\");"},{"file":"backend/src/Modules/Resources/ThingsBooksy.Modules.Resources.Migrations/Migrations/20260511001231_InitResources.cs","line":152,"excerpt":"name: \"FK_resource_property_definitions_resource_types_ResourceTypeId\""},{"file":"backend/src/Modules/ManagementGroups/ThingsBooksy.Modules.ManagementGroups.IntegrationTests/Clients/ManagementGroupsTestClient.cs","line":128,"excerpt":"\"\"\"SELECT COUNT(1) FROM resources.resource_types WHERE \"GroupId\" = @groupId\"\"\","},{"file":"backend/src/Modules/Resources/ThingsBooksy.Modules.Resources.IntegrationTests/ResourceTypes/SoftDeleteResourceTypeTests.cs","line":64,"excerpt":"// Assert — the row remains in resources.resource_types with DeletedAt set (IgnoreQueryFilters)"}],"confidence":"likely","by":"code-researcher 016-rename-resource-schema-code-researcher-4-muqu98kz"}
